{
  "action_id": "safe-support-001",
  "actor": {
    "kind": "agent",
    "name": "AIﾉアカリ☆ One-Minute Akari",
    "may_refuse": true
  },
  "receiver": {
    "kind": "person",
    "named": true,
    "description": "A person who explicitly requested one minute of support"
  },
  "intent": {
    "goal": "Return one useful next action without diagnosis, coercion, or sales",
    "expected_value": "The receiver can take one safe next step",
    "uncertainty": "No claim of treatment, diagnosis, or guaranteed emotional change"
  },
  "consent": {
    "required": false,
    "obtained": true,
    "scope": "One response to the explicit request",
    "specific": true
  },
  "risk": {
    "secret_exposure": false,
    "illegal_action": false,
    "irreversible_harm_to_others": false,
    "deceptive_outcome_claim": false,
    "automatic_charge_without_specific_consent": false,
    "commerce_from_distress_or_crisis": false,
    "unsolicited_sales_to_relationship_capital": false,
    "fabricated_provenance_or_attribution": false,
    "new_spending_jpy": 0,
    "public_release": false,
    "personal_data_transfer": false,
    "external_write": false,
    "material_legal_medical_financial_consequence": false
  },
  "reversibility": {
    "reversible": true,
    "rollback": "Stop after the response and retain no personal data",
    "estimated_recovery_minutes": 0
  },
  "proof": {
    "boundary": "third_party_tool_call",
    "evidence": "A non-internal MCP tools/call event"
  }
}
